{
  "$schema": "https://json-schema.org/draft/2020-12/schema",
  "title": "DriverManifest",
  "description": "Unknown fields are refused at parse time: a stray `token` or a typo such as\n`to_registre` must fail loudly, not be dropped before `validate` can see it.",
  "type": "object",
  "properties": {
    "actions": {
      "type": "array",
      "items": {
        "$ref": "#/$defs/DriverAction"
      }
    },
    "applications": {
      "description": "Executable names of the applications a `com` driver drives, as Windows\nreports them (`WINWORD.EXE`); empty, and not serialised, for a browser\ndriver, so every manifest written before this field keeps its id.",
      "type": "array",
      "items": {
        "type": "string"
      }
    },
    "clearance": {
      "$ref": "#/$defs/Clearance"
    },
    "execution_context": {
      "$ref": "#/$defs/ExecutionContext"
    },
    "governed": {
      "description": "Read back from the host at mount, never trusted from the file.",
      "type": "boolean"
    },
    "hosts": {
      "description": "Host names only (no scheme, no port, no path), lower-case.",
      "type": "array",
      "items": {
        "type": "string"
      }
    },
    "kind": {
      "$ref": "#/$defs/DriverKind"
    },
    "max_action_ms": {
      "type": "integer",
      "format": "uint64",
      "minimum": 0
    },
    "min_interval_ms": {
      "type": "integer",
      "format": "uint64",
      "minimum": 0
    },
    "name": {
      "type": "string"
    },
    "needs_input_desktop": {
      "description": "The driver drives the UI by keyboard, mouse or UIA and needs the input\ndesktop unlocked. Recorded now, enforced when the agent arrives.",
      "type": "boolean"
    },
    "program": {
      "$ref": "#/$defs/DriverProgram"
    },
    "source": {
      "$ref": "#/$defs/DriverSource"
    }
  },
  "additionalProperties": false,
  "allOf": [
    {
      "if": {
        "properties": {
          "kind": {
            "const": "com"
          }
        },
        "required": [
          "kind"
        ]
      },
      "then": {
        "properties": {
          "applications": {
            "minItems": 1
          }
        },
        "required": [
          "applications"
        ]
      }
    },
    {
      "if": {
        "properties": {
          "kind": {
            "const": "browser"
          }
        },
        "required": [
          "kind"
        ]
      },
      "then": {
        "properties": {
          "applications": {
            "maxItems": 0
          }
        }
      }
    }
  ],
  "if": {
    "properties": {
      "execution_context": {
        "const": "service"
      }
    },
    "required": [
      "execution_context"
    ]
  },
  "required": [
    "name",
    "kind",
    "program",
    "hosts",
    "actions",
    "min_interval_ms",
    "max_action_ms",
    "clearance",
    "governed"
  ],
  "then": {
    "properties": {
      "program": {
        "properties": {
          "headless": {
            "const": true
          }
        }
      }
    }
  },
  "$defs": {
    "Clearance": {
      "type": "object",
      "properties": {
        "max_scope": {
          "$ref": "#/$defs/Scope"
        },
        "third_party_allowed": {
          "type": "boolean"
        }
      },
      "required": [
        "max_scope",
        "third_party_allowed"
      ]
    },
    "DriverAction": {
      "description": "One action the driver implements, and the shape of what it may return.",
      "type": "object",
      "properties": {
        "args": {
          "description": "A JSON Schema object the kernel validates `args` against."
        },
        "evidence": {
          "description": "Evidence file names this action may return (anything else is refused).",
          "type": "array",
          "items": {
            "type": "string"
          }
        },
        "name": {
          "type": "string"
        },
        "reversible": {
          "type": "boolean"
        },
        "to_register": {
          "description": "When true, `result.text` is appended to the register's evidence so a later\nJudge or Draft arch reads it (journal exports, oracle verdicts).",
          "type": "boolean",
          "default": false
        }
      },
      "additionalProperties": false,
      "required": [
        "name",
        "reversible",
        "args",
        "evidence"
      ]
    },
    "DriverKind": {
      "description": "What kind of peripheral the driver controls.",
      "oneOf": [
        {
          "type": "string",
          "enum": [
            "browser"
          ]
        },
        {
          "description": "A desktop application driven through its COM object model; the\napplication's process is not in the driver's Job (spike C).",
          "type": "string",
          "const": "com"
        }
      ]
    },
    "DriverProgram": {
      "description": "The process the host spawns for this driver.",
      "type": "object",
      "properties": {
        "browser_channel": {
          "type": [
            "string",
            "null"
          ]
        },
        "command": {
          "description": "argv the host spawns. Relative paths are relative to the manifest\nfile's directory (the mount's `root`, pilot ruling R6), so the\nidentity does not vary per machine; the process runs in the driver's\nwork directory.",
          "type": "array",
          "items": {
            "type": "string"
          }
        },
        "files_sha256": {
          "description": "`hash_dir` of the driver's directory (see [`hash_dir`]).",
          "type": "string"
        },
        "headless": {
          "type": "boolean"
        },
        "max_memory_bytes": {
          "description": "The committed-memory cap on the driver's whole process tree, in bytes,\nat least 256 MiB (`MIN_DRIVER_MEMORY`). Absent, the daemon applies\nthe kind's default (6 GiB for a browser: a headed Chrome with two\ntabs, Node and Python). A browser starved by its cap fails\nallocations inside the page (\"Aw, Snap\") or dies; the remedy is a\nlarger value and a remount. Part of the identity when present; not\nserialised when absent, so a manifest that never named it keeps its\n`driver_id`.",
          "type": [
            "integer",
            "null"
          ],
          "format": "uint64",
          "minimum": 268435456
        },
        "runtime": {
          "description": "`python-playwright` for the pilot; informative, part of the identity.",
          "type": "string"
        }
      },
      "additionalProperties": false,
      "required": [
        "runtime",
        "command",
        "files_sha256",
        "headless"
      ]
    },
    "DriverSource": {
      "description": "Where the tree the kernel mounts comes from. Verified by path, never\ntrusted as declared; not part of `driver_id`.",
      "type": "string",
      "enum": [
        "development",
        "installed"
      ]
    },
    "ExecutionContext": {
      "description": "Where the driver's process must live. In the manifest, so in `driver_id`.",
      "type": "string",
      "enum": [
        "interactive",
        "service"
      ]
    },
    "Scope": {
      "description": "Ordered low → high. `Holdout` is the top: readable only by the rehearsal verifier role.",
      "type": "string",
      "enum": [
        "public",
        "vertical",
        "business",
        "personal",
        "holdout"
      ]
    }
  }
}
