{
  "name": "maskai-fixture",
  "kind": "browser",
  "program": {
    "runtime": "python-playwright",
    "command": [
      ".venv/Scripts/python.exe",
      "-I",
      "driver.py"
    ],
    "files_sha256": "sha256:ea7336c6b70ab8775d33090071fc9b64abc87a2253b10f98b15aea3e20289b16",
    "browser_channel": null,
    "headless": true,
    "max_memory_bytes": 6442450944
  },
  "hosts": [
    "127.0.0.1"
  ],
  "actions": [
    {
      "name": "mesurer_chargement",
      "reversible": true,
      "args": {
        "type": "object",
        "additionalProperties": false
      },
      "evidence": [
        "timing.json",
        "screen.png"
      ],
      "to_register": false
    },
    {
      "name": "nouvelle_conversation",
      "reversible": true,
      "args": {
        "type": "object",
        "additionalProperties": false
      },
      "evidence": [],
      "to_register": false
    },
    {
      "name": "joindre_document",
      "reversible": false,
      "args": {
        "type": "object",
        "properties": {
          "case": {
            "type": "string"
          }
        },
        "required": [
          "case"
        ],
        "additionalProperties": false
      },
      "evidence": [
        "attach.png",
        "network.json"
      ],
      "to_register": false
    },
    {
      "name": "poser_question",
      "reversible": false,
      "args": {
        "type": "object",
        "properties": {
          "case": {
            "type": "string"
          }
        },
        "required": [
          "case"
        ],
        "additionalProperties": false
      },
      "evidence": [
        "dom.html",
        "guard.json",
        "sent.json",
        "network.json",
        "answer.png"
      ],
      "to_register": false
    },
    {
      "name": "envoyer_message",
      "reversible": false,
      "args": {
        "type": "object",
        "properties": {
          "text": {
            "type": "string"
          }
        },
        "required": [
          "text"
        ],
        "additionalProperties": false
      },
      "evidence": [
        "dom.html",
        "guard.json",
        "sent.json",
        "network.json",
        "answer.png"
      ],
      "to_register": false
    },
    {
      "name": "lire_reponse",
      "reversible": true,
      "args": {
        "type": "object",
        "additionalProperties": false
      },
      "evidence": [
        "dom.html"
      ],
      "to_register": false
    },
    {
      "name": "capturer_flux",
      "reversible": true,
      "args": {
        "type": "object",
        "additionalProperties": false
      },
      "evidence": [
        "network.json"
      ],
      "to_register": false
    },
    {
      "name": "verdict_oracle",
      "reversible": true,
      "args": {
        "type": "object",
        "properties": {
          "case": {
            "type": "string"
          }
        },
        "required": [
          "case"
        ],
        "additionalProperties": false
      },
      "evidence": [
        "journal.jsonl"
      ],
      "to_register": true
    },
    {
      "name": "lister_conversations",
      "reversible": true,
      "args": {
        "type": "object",
        "additionalProperties": false
      },
      "evidence": [
        "screen.png"
      ],
      "to_register": false
    },
    {
      "name": "charge_concurrente",
      "reversible": false,
      "args": {
        "type": "object",
        "properties": {
          "cases": {
            "type": "array",
            "items": {
              "type": "string"
            },
            "minItems": 2,
            "maxItems": 2
          }
        },
        "required": [
          "cases"
        ],
        "additionalProperties": false
      },
      "evidence": [
        "network.json",
        "screen.png"
      ],
      "to_register": false
    },
    {
      "name": "capture_ecran",
      "reversible": true,
      "args": {
        "type": "object",
        "additionalProperties": false
      },
      "evidence": [
        "screen.png"
      ],
      "to_register": false
    },
    {
      "name": "exporter_journal",
      "reversible": true,
      "args": {
        "type": "object",
        "additionalProperties": false
      },
      "evidence": [
        "journal.jsonl"
      ],
      "to_register": true
    }
  ],
  "min_interval_ms": 2000,
  "max_action_ms": 240000,
  "clearance": {
    "max_scope": "business",
    "third_party_allowed": true
  },
  "governed": false
}
